{"collector":{"adapter_registry_version":"second-observer.adapters/v1","binary_sha256":"aaaaaaaaaaaaaaaaaaaaaaaaaaaaaaaaaaaaaaaaaaaaaaaaaaaaaaaaaaaaaaaa","configuration_sha256":"bbbbbbbbbbbbbbbbbbbbbbbbbbbbbbbbbbbbbbbbbbbbbbbbbbbbbbbbbbbbbbbb","metric_registry_version":"second-observer.metrics/v1","version":"0.1.0-fixture"},"comparability":{"blocking_mismatches":["fixture"],"disposition":"INCOMPARABLE"},"consent":{"approved_adapters":["codex"],"approved_field_classes":["filesystem_metadata","timestamps","event_types","counters","message_text"],"collection_approved_at":"2026-08-18T00:00:00Z","content_analysis":true,"manifest_sha256":"cccccccccccccccccccccccccccccccccccccccccccccccccccccccccccccccc"},"contract_version":"second-observer.study-export/v1","coverage":[],"integrity":{"payload_sha256":"c9b9b4f889b9a6e2852d59f41da98775c3e49a3bc116c056de8bb363cb1ffda2"},"metrics":[{"adapter_id":"codex","eligible_count":20,"evidence_class":"observed_counter","metric_id":"human_turns","missing_count":0,"observed_count":20,"source_definition_version":"fixture-adapter/v1","unit":"turns","value":20,"window_id":"baseline-28d"},{"adapter_id":"codex","eligible_count":8,"evidence_class":"local_content_heuristic","metric_id":"manual_relay_ratio","missing_count":0,"observed_count":8,"source_definition_version":"fixture-adapter/v1","unit":"ratio","value":0.125,"window_id":"baseline-28d"}],"nonclaims":["not complete history","not productivity","not correctness","not causal effect","not cost savings","not provider billing receipt"],"privacy":{"content_exported":false,"content_persisted":false,"forbidden_fields_absent":true},"study":{"device_id":"device_fixture_01","participant_id":"participant_fixture_01","run_id":"run_fixture_00001"},"windows":[{"end":"2026-08-18T00:00:00Z","id":"retained-history","kind":"retained_history","start":null,"timezone":"UTC"},{"end":"2026-08-18T00:00:00Z","id":"baseline-28d","kind":"baseline","start":"2026-07-21T00:00:00Z","timezone":"UTC"}]}